{
  "schema_version": "1.0",
  "cycle_id": "N2_zone_aware_characterization",
  "hypothesis": "Zone-aware framework: TP rate stratified by methylation zones provides characterization-only signal (NOT used for QS adjustment, NOT a tier upgrade vehicle)",
  "validation_layers": ["L1_AUC_screening", "L3_cross_sample"],
  "expected_effect": {
    "metric": "Zone_TP_rate_difference_characterization",
    "min_threshold": 0.05,
    "direction": "greater_than",
    "stop_criteria": "if no meaningful zone difference, conclude no characterization value (NEGATIVE)"
  },
  "preconditions": {
    "binary_version": null,
    "dataset_id": "zone_aware_master_post_KDE_corrected_caller_af_separate",
    "upstream_reports": [
      "InterSubMod/docs/CURRENT_FOCUS.md"
    ],
    "feature_flags": {"zone_aware": true, "qs_adjustment": false}
  },
  "samples": ["HCC1395", "HCC1395_DORADO", "H1437", "H2009", "HCC1937", "HCC1954", "COLO829"],
  "skills_invoked": ["feature-layered-observation", "multi-sample-consistency", "run-evaluator"],
  "estimated_duration_hours": 6.0
}
